{
  "schemaVersion": 1,
  "reportId": "DOC-RESEARCH-MNFS-RESEARCH-DOCUMENTATION-GOVERNANCE-v1",
  "asOf": "2026-08-02",
  "sources": [
    {
      "id": "diataxis",
      "title": "Diátaxis documentation framework",
      "url": "https://diataxis.fr/",
      "kind": "standard",
      "supports": [
        "Tutorial, how-to, reference and explanation classification"
      ],
      "accessed": "2026-08-02"
    },
    {
      "id": "madr",
      "title": "Markdown Architectural Decision Records",
      "url": "https://github.com/adr/madr",
      "kind": "repository",
      "supports": [
        "ADR structure, status and decision-log patterns"
      ],
      "accessed": "2026-08-02"
    },
    {
      "id": "kubernetes-keps",
      "title": "Kubernetes Enhancement Proposals",
      "url": "https://github.com/kubernetes/enhancements/tree/master/keps",
      "kind": "repository",
      "supports": [
        "Structured capability proposals, tests, graduation and implementation history"
      ],
      "accessed": "2026-08-02"
    },
    {
      "id": "python-pep1",
      "title": "PEP 1 – PEP Purpose and Guidelines",
      "url": "https://peps.python.org/pep-0001/",
      "kind": "standard",
      "supports": [
        "Proposal lifecycle and preservation of rejected/superseded history"
      ],
      "accessed": "2026-08-02"
    },
    {
      "id": "backstage-techdocs",
      "title": "Backstage TechDocs concepts",
      "url": "https://backstage.io/docs/features/techdocs/concepts/",
      "kind": "official_docs",
      "supports": [
        "Docs-like-code and generated-site projection"
      ],
      "accessed": "2026-08-02"
    },
    {
      "id": "github-codeowners",
      "title": "About code owners",
      "url": "https://docs.github.com/en/repositories/managing-your-repositorys-settings-and-features/customizing-your-repository/about-code-owners",
      "kind": "official_docs",
      "supports": [
        "Path ownership and required-review governance"
      ],
      "accessed": "2026-08-02"
    }
  ]
}
