{
  "schemaVersion": 1,
  "reportId": "DOC-RESEARCH-MNFS-RESEARCH-CAPABILITY-ROADMAP-v1",
  "asOf": "2026-08-02",
  "sources": [
    {
      "id": "walking-skeleton",
      "title": "Programs in product mode",
      "url": "https://martinfowler.com/articles/programs-in-product-mode.html",
      "kind": "research",
      "supports": [
        "Walking skeleton and early end-to-end integration principles"
      ],
      "accessed": "2026-08-02"
    },
    {
      "id": "dora-platform",
      "title": "DORA platform engineering capability",
      "url": "https://dora.dev/capabilities/platform-engineering/",
      "kind": "research",
      "supports": [
        "Minimum viable platform and platform-as-a-product guidance"
      ],
      "accessed": "2026-08-02"
    },
    {
      "id": "google-golden-paths",
      "title": "Golden paths for engineering execution consistency",
      "url": "https://cloud.google.com/blog/products/application-development/golden-paths-for-engineering-execution-consistency",
      "kind": "product_docs",
      "supports": [
        "Golden Path evolution, self-service and cognitive-load reduction"
      ],
      "accessed": "2026-08-02"
    },
    {
      "id": "backstage-templates",
      "title": "Backstage Software Templates",
      "url": "https://backstage.io/docs/features/software-templates/",
      "kind": "official_docs",
      "supports": [
        "Template-driven platform workflows and operator-facing steps"
      ],
      "accessed": "2026-08-02"
    },
    {
      "id": "evolutionary-architecture",
      "title": "Building Evolutionary Architectures",
      "url": "https://www.thoughtworks.com/insights/books/building-evolutionary-architectures-second-edition",
      "kind": "research",
      "supports": [
        "Incremental change and architecture fitness-function concepts"
      ],
      "accessed": "2026-08-02"
    }
  ]
}
