{
  "schemaVersion": 1,
  "reportId": "DOC-RESEARCH-MNFS-RESEARCH-PI-MEMORY-CONTEXT-MESSAGING-v1",
  "asOf": "2026-08-02",
  "sources": [
    {
      "id": "pi-sessions",
      "title": "Pi coding agent sessions",
      "url": "https://github.com/badlogic/pi-mono/blob/main/packages/coding-agent/docs/sessions.md",
      "kind": "official_docs",
      "supports": [
        "Pi JSONL session history, branching and resume model"
      ],
      "accessed": "2026-08-02"
    },
    {
      "id": "pi-compaction",
      "title": "Pi coding agent compaction",
      "url": "https://github.com/badlogic/pi-mono/blob/main/packages/coding-agent/docs/compaction.md",
      "kind": "official_docs",
      "supports": [
        "Native lossy compaction and extension hooks"
      ],
      "accessed": "2026-08-02"
    },
    {
      "id": "pi-extensions",
      "title": "Pi extension documentation",
      "url": "https://github.com/badlogic/pi-mono/blob/main/packages/coding-agent/docs/extensions.md",
      "kind": "official_docs",
      "supports": [
        "Session lifecycle interception, custom tools and compaction replacement"
      ],
      "accessed": "2026-08-02"
    },
    {
      "id": "pi-observational-memory",
      "title": "pi-observational-memory package",
      "url": "https://pi.dev/packages/pi-observational-memory",
      "kind": "product_docs",
      "version": "3.0.3",
      "supports": [
        "Observer, Reflector, Dropper, ledger entries and source-backed recall"
      ],
      "accessed": "2026-08-02"
    },
    {
      "id": "mastra-observational-memory",
      "title": "Mastra Observational Memory research",
      "url": "https://mastra.ai/research/observational-memory",
      "kind": "research",
      "supports": [
        "Observer/Reflector architecture, compression and LongMemEval results"
      ],
      "accessed": "2026-08-02"
    },
    {
      "id": "pi-memctx",
      "title": "pi-memctx package",
      "url": "https://pi.dev/packages/pi-memctx",
      "kind": "product_docs",
      "supports": [
        "Workspace memory packs, retrieval and review queue patterns"
      ],
      "accessed": "2026-08-02"
    },
    {
      "id": "pi-agenticoding",
      "title": "pi-agenticoding package",
      "url": "https://pi.dev/packages/pi-agenticoding",
      "kind": "product_docs",
      "supports": [
        "Task-scoped notebook and deliberate handoff patterns"
      ],
      "accessed": "2026-08-02"
    },
    {
      "id": "pi-link",
      "title": "pi-link package",
      "url": "https://pi.dev/packages/pi-link",
      "kind": "product_docs",
      "supports": [
        "Local cross-terminal notification and steering capabilities"
      ],
      "accessed": "2026-08-02"
    }
  ]
}
